{
  "schema": "run/1",
  "run_id": "E003-r0001",
  "experiment": "E003",
  "arm": "control",
  "rep": 1,
  "code_commit": "a25f47a",
  "machine": "desk",
  "artifact": {
    "set": "toy-1.0-1ff31629",
    "variant": null
  },
  "runtime": {
    "driver": "runtime/toy.py@a25f47a",
    "platform": "python-3.12/ubuntu-24.04",
    "fingerprint": {
      "python": "3.12.3"
    }
  },
  "interventions": [
    {
      "level": "I0",
      "what": "none"
    }
  ],
  "start_state": {
    "id": "S-new-game",
    "sha256": "41e334d96acd6f0853dfa00ab0f02372cb8b17877592ad6f69b9796265e251d3",
    "restore": "fresh process + new game, default settings"
  },
  "seed": null,
  "actions": {
    "script": "experiments/E003-cold-start/run.py",
    "sha256": "d6af0459a37d985953d7040c14f53feb3b9cc9e58b543aa3c2b80256d276c5e0",
    "args": []
  },
  "observations": [],
  "outputs": [],
  "started": "2026-10-02T09:00:00Z",
  "ended": "2026-10-02T09:00:40Z",
  "status": "aborted: window did not appear within 40 s"
}
