{
  "schema": "run/1",
  "run_id": "E002-r0001",
  "experiment": "E002",
  "arm": "control",
  "rep": 1,
  "code_commit": "a25f47a",
  "machine": "desk",
  "artifact": {
    "set": "toy-1.0-1ff31629",
    "variant": null
  },
  "runtime": {
    "driver": "runtime/toy.py@a25f47a",
    "platform": "python-3.12/ubuntu-24.04",
    "fingerprint": {
      "python": "3.12.3"
    }
  },
  "interventions": [
    {
      "level": "I0",
      "what": "none"
    }
  ],
  "start_state": {
    "id": "S-new-game",
    "sha256": "41e334d96acd6f0853dfa00ab0f02372cb8b17877592ad6f69b9796265e251d3",
    "restore": "fresh process + new game, default settings"
  },
  "seed": null,
  "actions": {
    "script": "experiments/E001-reinforcement/run.py",
    "sha256": "d6af0459a37d985953d7040c14f53feb3b9cc9e58b543aa3c2b80256d276c5e0",
    "args": [
      "--arm",
      "B"
    ]
  },
  "observations": [
    {
      "step": 0,
      "source": "save",
      "field": "raw:bytes[0x1A0:0x1A4]",
      "value": "05000000"
    },
    {
      "step": 1,
      "source": "ui-text",
      "field": "reinforcement prompt",
      "value": "You receive 3 armies."
    },
    {
      "step": 1,
      "source": "screen",
      "ref": "sha256:e15d4bbc82b54b0d83aab78a7b2ef128bae8d990972924ef8f47c0cb00a4286d"
    }
  ],
  "outputs": [
    {
      "name": "after.sav",
      "sha256": "c5bce929e99e510b9879bda5232f412c6c6fadddcfcf10678b835182000c4b5a",
      "store": "release:E001"
    },
    {
      "name": "after.png",
      "sha256": "e15d4bbc82b54b0d83aab78a7b2ef128bae8d990972924ef8f47c0cb00a4286d",
      "store": "release:E001"
    }
  ],
  "started": "2026-10-02T09:00:00Z",
  "ended": "2026-10-02T09:00:04Z",
  "status": "aborted: game window did not appear within 40 s"
}
